Username,Content,Created at
,Masyarakat mengaku masih takut ptm,
,ptm kena mental,
,pemprov dki batalkan ptm 100%,
,covid di dom ku meluas woi,
,ptm hehehe ptm nangis aja,
,pilih ptm karena lebih mudah paham materi,
,lebih milih ptm. Cape tapi tugas selesai di sekolah,
,aku udah selesai pjj,
,Ya Allah maaf ngeluh ptm cape soalnya,
,"ptm kapan ya, gua butuh duit",
,"semangat ya mutual ku, angka harian covid mulai meningkat, mulai tingkatkan prokes, dan hindari pertemuan tatap muka sebisa mungkin",
,setuju bu. Gak perlu memaksakan untuk ptm 100%,
,tercatat ada 100 siswa dan guru terkonfirmasi positif omicron,
,ptm ditunda lagi min karena covid. Sedih saya,
,"9 siswa terpapar covid, smp negeri 22 malang hentikan ptm",
,pemberhentian pembelajaran tatap muka ptm tengah terjadi,
,pemberhentian pembelajaran tatap muka ptm tengah terjadi,
,ptm terus jalan ,
,pemerintah genjot vaksinasi booster covid 19,
,pemerintah genjot vaksinasi booster covid 20,
,pemerintah genjot vaksinasi booster covid 21,
,pemerintah genjot vaksinasi booster covid 22,
,pemerintah blitar tak ragu terus jalan kan pembelajran tatap muka,
,patuhi prokes saat ptm yuk,
,Alhamdulillah covid turun bisa ptm,
,ptm enak kaya lebih produktif gitu dehh,
